[
  {
    "item_id": "0040e8df0c2c95300e513842",
    "transition_id": "96c36b38c3da9ee77b035039",
    "packet_id": "packet:0040e8df0c2c95300e513842:96c36b38c3da9ee77b035039",
    "annotator_id": "A01",
    "rubric_version": "v2.0",
    "original_validity": "SUPPORTED",
    "target_state_t1": "RESOLVED",
    "lifecycle_label": "RETIRE",
    "instructional_priority": "LOW",
    "leakage_label": "NOT_EVALUATED",
    "evidence_ids": [
      "source:0040e8df0c2c95300e513842:S_t",
      "source:0040e8df0c2c95300e513842:S_t+1",
      "diff:0040e8df0c2c95300e513842",
      "execution:0040e8df0c2c95300e513842:st:compile",
      "execution:0040e8df0c2c95300e513842:st1:compile",
      "official_test:prob_019_T1",
      "execution:0040e8df0c2c95300e513842:st:prob_019_T1",
      "execution:0040e8df0c2c95300e513842:st1:prob_019_T1",
      "official_test:prob_019_T2",
      "execution:0040e8df0c2c95300e513842:st:prob_019_T2",
      "execution:0040e8df0c2c95300e513842:st1:prob_019_T2",
      "official_test:prob_019_T3",
      "execution:0040e8df0c2c95300e513842:st:prob_019_T3",
      "execution:0040e8df0c2c95300e513842:st1:prob_019_T3"
    ],
    "confidence": 5,
    "short_reason": "S-RESOLVE: the focal defect is supported at S_t and the same target is fixed in S_t+1."
  },
  {
    "item_id": "00c4168755f7a9c2d723f93e",
    "transition_id": "d6bfb0d3dd003f37308313c8",
    "packet_id": "packet:00c4168755f7a9c2d723f93e:d6bfb0d3dd003f37308313c8",
    "annotator_id": "A01",
    "rubric_version": "v2.0",
    "original_validity": "SUPPORTED",
    "target_state_t1": "RESOLVED",
    "lifecycle_label": "RETIRE",
    "instructional_priority": "LOW",
    "leakage_label": "NOT_EVALUATED",
    "evidence_ids": [
      "source:00c4168755f7a9c2d723f93e:S_t",
      "source:00c4168755f7a9c2d723f93e:S_t+1",
      "diff:00c4168755f7a9c2d723f93e",
      "execution:00c4168755f7a9c2d723f93e:st:compile",
      "execution:00c4168755f7a9c2d723f93e:st1:compile",
      "official_test:prob_035_T1",
      "execution:00c4168755f7a9c2d723f93e:st:prob_035_T1",
      "execution:00c4168755f7a9c2d723f93e:st1:prob_035_T1",
      "official_test:prob_035_T2",
      "execution:00c4168755f7a9c2d723f93e:st:prob_035_T2",
      "execution:00c4168755f7a9c2d723f93e:st1:prob_035_T2"
    ],
    "confidence": 5,
    "short_reason": "S-RESOLVE: the focal defect is supported at S_t and the same target is fixed in S_t+1."
  },
  {
    "item_id": "040d98ea14e3d93da4d0e172",
    "transition_id": "a219228bee59df71588f3e70",
    "packet_id": "packet:040d98ea14e3d93da4d0e172:a219228bee59df71588f3e70",
    "annotator_id": "A01",
    "rubric_version": "v2.0",
    "original_validity": "SUPPORTED",
    "target_state_t1": "PRESENT",
    "lifecycle_label": "KEEP",
    "instructional_priority": "HIGH",
    "leakage_label": "NOT_EVALUATED",
    "evidence_ids": [
      "source:040d98ea14e3d93da4d0e172:S_t",
      "source:040d98ea14e3d93da4d0e172:S_t+1",
      "diff:040d98ea14e3d93da4d0e172",
      "execution:040d98ea14e3d93da4d0e172:st:compile",
      "execution:040d98ea14e3d93da4d0e172:st1:compile",
      "official_test:prob_035_T1",
      "execution:040d98ea14e3d93da4d0e172:st:prob_035_T1",
      "execution:040d98ea14e3d93da4d0e172:st1:prob_035_T1",
      "official_test:prob_035_T2",
      "execution:040d98ea14e3d93da4d0e172:st:prob_035_T2",
      "execution:040d98ea14e3d93da4d0e172:st1:prob_035_T2"
    ],
    "confidence": 5,
    "short_reason": "K-PERSIST: the focal defect is supported at S_t and remains in S_t+1."
  },
  {
    "item_id": "0637d0023f5203aed00ba8a2",
    "transition_id": "557e053c28cad954a61fff55",
    "packet_id": "packet:0637d0023f5203aed00ba8a2:557e053c28cad954a61fff55",
    "annotator_id": "A01",
    "rubric_version": "v2.0",
    "original_validity": "SUPPORTED",
    "target_state_t1": "PRESENT",
    "lifecycle_label": "KEEP",
    "instructional_priority": "HIGH",
    "leakage_label": "NOT_EVALUATED",
    "evidence_ids": [
      "source:0637d0023f5203aed00ba8a2:S_t",
      "source:0637d0023f5203aed00ba8a2:S_t+1",
      "diff:0637d0023f5203aed00ba8a2",
      "execution:0637d0023f5203aed00ba8a2:st:compile",
      "execution:0637d0023f5203aed00ba8a2:st1:compile",
      "official_test:prob_003_T1",
      "execution:0637d0023f5203aed00ba8a2:st:prob_003_T1",
      "execution:0637d0023f5203aed00ba8a2:st1:prob_003_T1",
      "official_test:prob_003_T2",
      "execution:0637d0023f5203aed00ba8a2:st:prob_003_T2",
      "execution:0637d0023f5203aed00ba8a2:st1:prob_003_T2",
      "official_test:prob_003_T3",
      "execution:0637d0023f5203aed00ba8a2:st:prob_003_T3",
      "execution:0637d0023f5203aed00ba8a2:st1:prob_003_T3"
    ],
    "confidence": 5,
    "short_reason": "K-PERSIST: the focal defect is supported at S_t and remains in S_t+1."
  },
  {
    "item_id": "07d61a09618f024b4a8ee377",
    "transition_id": "c83f7b8b941c0fd7e8183244",
    "packet_id": "packet:07d61a09618f024b4a8ee377:c83f7b8b941c0fd7e8183244",
    "annotator_id": "A01",
    "rubric_version": "v2.0",
    "original_validity": "SUPPORTED",
    "target_state_t1": "RESOLVED",
    "lifecycle_label": "RETIRE",
    "instructional_priority": "LOW",
    "leakage_label": "NOT_EVALUATED",
    "evidence_ids": [
      "source:07d61a09618f024b4a8ee377:S_t",
      "source:07d61a09618f024b4a8ee377:S_t+1",
      "diff:07d61a09618f024b4a8ee377",
      "execution:07d61a09618f024b4a8ee377:st:compile",
      "execution:07d61a09618f024b4a8ee377:st1:compile",
      "official_test:prob_035_T1",
      "execution:07d61a09618f024b4a8ee377:st:prob_035_T1",
      "execution:07d61a09618f024b4a8ee377:st1:prob_035_T1",
      "official_test:prob_035_T2",
      "execution:07d61a09618f024b4a8ee377:st:prob_035_T2",
      "execution:07d61a09618f024b4a8ee377:st1:prob_035_T2"
    ],
    "confidence": 5,
    "short_reason": "S-RESOLVE: the focal defect is supported at S_t and the same target is fixed in S_t+1."
  },
  {
    "item_id": "080e97e7c467de51a27ecc33",
    "transition_id": "381b99837df4e0e5c901bd97",
    "packet_id": "packet:080e97e7c467de51a27ecc33:381b99837df4e0e5c901bd97",
    "annotator_id": "A01",
    "rubric_version": "v2.0",
    "original_validity": "SUPPORTED",
    "target_state_t1": "RESOLVED",
    "lifecycle_label": "RETIRE",
    "instructional_priority": "LOW",
    "leakage_label": "NOT_EVALUATED",
    "evidence_ids": [
      "source:080e97e7c467de51a27ecc33:S_t",
      "source:080e97e7c467de51a27ecc33:S_t+1",
      "diff:080e97e7c467de51a27ecc33",
      "execution:080e97e7c467de51a27ecc33:st:compile",
      "execution:080e97e7c467de51a27ecc33:st1:compile",
      "official_test:prob_035_T1",
      "execution:080e97e7c467de51a27ecc33:st:prob_035_T1",
      "execution:080e97e7c467de51a27ecc33:st1:prob_035_T1",
      "official_test:prob_035_T2",
      "execution:080e97e7c467de51a27ecc33:st:prob_035_T2",
      "execution:080e97e7c467de51a27ecc33:st1:prob_035_T2"
    ],
    "confidence": 5,
    "short_reason": "S-RESOLVE: the focal defect is supported at S_t and the same target is fixed in S_t+1."
  },
  {
    "item_id": "080ff63aa16eaaf9bf2b3e0f",
    "transition_id": "1b70c218a1d0dfc3f8ca19f3",
    "packet_id": "packet:080ff63aa16eaaf9bf2b3e0f:1b70c218a1d0dfc3f8ca19f3",
    "annotator_id": "A01",
    "rubric_version": "v2.0",
    "original_validity": "SUPPORTED",
    "target_state_t1": "RESOLVED",
    "lifecycle_label": "RETIRE",
    "instructional_priority": "LOW",
    "leakage_label": "NOT_EVALUATED",
    "evidence_ids": [
      "source:080ff63aa16eaaf9bf2b3e0f:S_t",
      "source:080ff63aa16eaaf9bf2b3e0f:S_t+1",
      "diff:080ff63aa16eaaf9bf2b3e0f",
      "execution:080ff63aa16eaaf9bf2b3e0f:st:compile",
      "execution:080ff63aa16eaaf9bf2b3e0f:st1:compile",
      "official_test:prob_019_T1",
      "execution:080ff63aa16eaaf9bf2b3e0f:st:prob_019_T1",
      "execution:080ff63aa16eaaf9bf2b3e0f:st1:prob_019_T1",
      "official_test:prob_019_T2",
      "execution:080ff63aa16eaaf9bf2b3e0f:st:prob_019_T2",
      "execution:080ff63aa16eaaf9bf2b3e0f:st1:prob_019_T2",
      "official_test:prob_019_T3",
      "execution:080ff63aa16eaaf9bf2b3e0f:st:prob_019_T3",
      "execution:080ff63aa16eaaf9bf2b3e0f:st1:prob_019_T3"
    ],
    "confidence": 5,
    "short_reason": "S-RESOLVE: the focal defect is supported at S_t and the same target is fixed in S_t+1."
  },
  {
    "item_id": "0905351be16c9764c3b4783d",
    "transition_id": "0fa699d076b6b959aac51e01",
    "packet_id": "packet:0905351be16c9764c3b4783d:0fa699d076b6b959aac51e01",
    "annotator_id": "A01",
    "rubric_version": "v2.0",
    "original_validity": "SUPPORTED",
    "target_state_t1": "PRESENT",
    "lifecycle_label": "KEEP",
    "instructional_priority": "HIGH",
    "leakage_label": "NOT_EVALUATED",
    "evidence_ids": [
      "source:0905351be16c9764c3b4783d:S_t",
      "source:0905351be16c9764c3b4783d:S_t+1",
      "diff:0905351be16c9764c3b4783d",
      "execution:0905351be16c9764c3b4783d:st:compile",
      "execution:0905351be16c9764c3b4783d:st1:compile",
      "official_test:prob_035_T1",
      "execution:0905351be16c9764c3b4783d:st:prob_035_T1",
      "execution:0905351be16c9764c3b4783d:st1:prob_035_T1",
      "official_test:prob_035_T2",
      "execution:0905351be16c9764c3b4783d:st:prob_035_T2",
      "execution:0905351be16c9764c3b4783d:st1:prob_035_T2"
    ],
    "confidence": 5,
    "short_reason": "K-PERSIST: the focal defect is supported at S_t and remains in S_t+1."
  },
  {
    "item_id": "09edfb4b9592f961bb8e50e0",
    "transition_id": "e31becec2d1cef661374a86e",
    "packet_id": "packet:09edfb4b9592f961bb8e50e0:e31becec2d1cef661374a86e",
    "annotator_id": "A01",
    "rubric_version": "v2.0",
    "original_validity": "SUPPORTED",
    "target_state_t1": "PRESENT",
    "lifecycle_label": "KEEP",
    "instructional_priority": "HIGH",
    "leakage_label": "NOT_EVALUATED",
    "evidence_ids": [
      "source:09edfb4b9592f961bb8e50e0:S_t",
      "source:09edfb4b9592f961bb8e50e0:S_t+1",
      "diff:09edfb4b9592f961bb8e50e0",